metric,fiscal_year,fiscal_quarter,extraction_method,reason
Diluted EPS,2026,Q4,missing_requires_review,EPS cannot be derived by subtraction due to changing share counts across quarters
Diluted EPS,2025,Q4,missing_requires_review,EPS cannot be derived by subtraction due to changing share counts across quarters
Diluted EPS,2024,Q4,missing_requires_review,EPS cannot be derived by subtraction due to changing share counts across quarters
Capital Expenditure,2024,Q1,missing_requires_review,No Q1 entry found
Capital Expenditure,2024,Q2,missing_requires_review,Missing YTD_Q2 or Q1 for derivation
Capital Expenditure,2024,Q3,missing_requires_review,Missing YTD_Q3 or YTD_Q2 for derivation
